{
  "brand": "RAM",
  "series": "RAM Floor Air Circulator",
  "model": "Floor Air Circulator 9\" (230mm)",
  "status": "active",
  "fan_category": "floor_fan",
  "fan_role": "circulation_fan",
  "include_in_default_airflow_calculator": true,
  "mounting_type": "floor_stand",
  "oscillation": false,
  "oscillation_degrees": null,
  "blade_diameter_cm": 23,
  "fan_diameter_cm": null,
  "airflow_m3_h": null,
  "airflow_cfm": null,
  "speed_levels": 2,
  "rpm_min": null,
  "rpm_max": null,
  "noise_db_min": null,
  "noise_db_max": null,
  "power_watts_min": 25,
  "power_watts_max": 25,
  "controller_compatible": false,
  "app_control": false,
  "wifi": false,
  "bluetooth": false,
  "recommended_tent_min_cm": null,
  "recommended_tent_max_cm": null,
  "source_url": "https://rapidairmovement.co.uk/products/floor-air-circulator/",
  "source_type": "manufacturer",
  "source_date": "2026-06-27",
  "confidence_level": "B",
  "uvp_amount": 19.95,
  "uvp_currency": "GBP",
  "notes": "9\"/230mm floor circulator 25W, 2 speeds, 360deg tilt head, chrome. Watts/speeds from manufacturer rapidairmovement.co.uk; price londongrow.com. No airflow/RPM/dB published."
}