{
  "brand": "Secret Jardin",
  "series": "Monkey Fan (W-series)",
  "model": "Monkey Fan MF16 (16W)",
  "status": "discontinued",
  "fan_category": "pole_clip_fan",
  "fan_role": "clip_fan",
  "include_in_default_airflow_calculator": true,
  "mounting_type": "clip_and_pole",
  "oscillation": false,
  "oscillation_degrees": null,
  "blade_diameter_cm": 15.2,
  "fan_diameter_cm": 20,
  "airflow_m3_h": null,
  "airflow_cfm": null,
  "speed_levels": 2,
  "rpm_min": 1500,
  "rpm_max": 2250,
  "noise_db_min": null,
  "noise_db_max": null,
  "power_watts_min": null,
  "power_watts_max": 16,
  "controller_compatible": false,
  "app_control": false,
  "wifi": false,
  "bluetooth": false,
  "recommended_tent_min_cm": null,
  "recommended_tent_max_cm": null,
  "source_url": "https://www.secretjardin.com/wp-content/uploads/2021/04/20210308-INSTRUCTION-MONKEY-FAN-A5.pdf",
  "source_type": "manufacturer_pdf",
  "source_date": "2026-06-27",
  "confidence_level": "B",
  "uvp_amount": 24.9,
  "uvp_currency": "EUR",
  "notes": "secretjardin manual: 16W, 2-speed (1500/2250rpm), blade 15.2cm, non-osc, clip Ø16-30mm, 240cm cable, 2m/s@70cm. No m3/h published. UVP ~22-30 EUR (my-smoky.de/growmart). 230V AC."
}