{
  "brand": "Spider Farmer",
  "series": "6 inch Clip Fan with Smart Controller",
  "model": "6\" Clip Fan + GGS Climate Controller Kit",
  "status": "active",
  "fan_category": "clip_fan",
  "fan_role": "oscillating_fan",
  "include_in_default_airflow_calculator": true,
  "mounting_type": "clip",
  "oscillation": true,
  "oscillation_degrees": 90,
  "blade_diameter_cm": 15.2,
  "fan_diameter_cm": null,
  "airflow_m3_h": 594.65,
  "airflow_cfm": 315,
  "speed_levels": 10,
  "rpm_min": 0,
  "rpm_max": 2100,
  "noise_db_min": null,
  "noise_db_max": null,
  "power_watts_min": 9,
  "power_watts_max": 9,
  "controller_compatible": true,
  "app_control": true,
  "wifi": true,
  "bluetooth": true,
  "recommended_tent_min_cm": null,
  "recommended_tent_max_cm": null,
  "source_url": "https://www.spider-farmer.com/products/6-inch-grow-tent-clip-fan-ggs-controller/",
  "source_type": "manufacturer",
  "source_date": "2026-06-27",
  "confidence_level": "A",
  "uvp_amount": 115.98,
  "uvp_currency": "USD",
  "notes": "spider-farmer.com: fan core specs 300-315CFM (509.7-594.65 m3/h), 0-2100RPM, 9W, 90deg+100deg vert, 10sp, IP54, WiFi/BT via GGS. Bundle w/ GGS controller; UVP=kit list."
}