{
  "brand": "Secret Jardin",
  "series": "Monkey Fan (W-series)",
  "model": "Monkey Fan MF30 (30W)",
  "status": "discontinued",
  "fan_category": "pole_clip_fan",
  "fan_role": "clip_fan",
  "include_in_default_airflow_calculator": true,
  "mounting_type": "clip_and_pole",
  "oscillation": false,
  "oscillation_degrees": null,
  "blade_diameter_cm": 17.8,
  "fan_diameter_cm": 23,
  "airflow_m3_h": null,
  "airflow_cfm": null,
  "speed_levels": 2,
  "rpm_min": 1500,
  "rpm_max": 2300,
  "noise_db_min": null,
  "noise_db_max": null,
  "power_watts_min": null,
  "power_watts_max": 30,
  "controller_compatible": false,
  "app_control": false,
  "wifi": false,
  "bluetooth": false,
  "recommended_tent_min_cm": null,
  "recommended_tent_max_cm": null,
  "source_url": "https://www.growmart.eu/Secret-Jardin-Monkey-Fan-18cm-30W_1",
  "source_type": "retailer",
  "source_date": "2026-06-27",
  "confidence_level": "B",
  "uvp_amount": 44.9,
  "uvp_currency": "EUR",
  "notes": "martingrowshop/growmart: 30W non-osc, 2-speed max 2300rpm, rotor 17.8cm/grid 23cm, 3.7m/s@70cm, 280x150x255mm 1.1kg, rec. up to 5m2. No m3/h. EU retail ~45-48 EUR. No verified AmazonDE ASIN."
}