{
  "brand": "Spider Farmer",
  "series": "6 inch Clip Fan",
  "model": "6-Inch Grow Tent Clip Fan (EC Motor, oscillating)",
  "status": "active",
  "fan_category": "clip_fan",
  "fan_role": "oscillating_fan",
  "include_in_default_airflow_calculator": true,
  "mounting_type": "clip",
  "oscillation": true,
  "oscillation_degrees": 90,
  "blade_diameter_cm": 15.2,
  "fan_diameter_cm": null,
  "airflow_m3_h": 595,
  "airflow_cfm": 315,
  "speed_levels": 10,
  "rpm_min": 0,
  "rpm_max": 2100,
  "noise_db_min": null,
  "noise_db_max": 33,
  "power_watts_min": null,
  "power_watts_max": 9,
  "controller_compatible": true,
  "app_control": true,
  "wifi": false,
  "bluetooth": false,
  "recommended_tent_min_cm": null,
  "recommended_tent_max_cm": null,
  "source_url": "https://www.spider-farmer.com/products/spider-farmer-6-inch-clip-fan-for-grow-tents/",
  "source_type": "manufacturer",
  "source_date": "2026-06-27",
  "confidence_level": "A",
  "uvp_amount": 69.99,
  "uvp_currency": "EUR",
  "notes": "6in clip fan, EC 9W, 300-315 CFM (509.7-594.65 m3/h), 0-2100 RPM, ~33dB, IP54, 90deg auto-osc +100deg vert, pole 16-25mm, GGS app-ready. UVP EUR69.99 (wondergrow.de). spider-farmer.com"
}