{
  "brand": "VIVOSUN",
  "series": "AeroWave A",
  "model": "AeroWave A6",
  "status": "active",
  "fan_category": "clip_fan",
  "fan_role": "oscillating_fan",
  "include_in_default_airflow_calculator": true,
  "mounting_type": "clip_and_pole",
  "oscillation": true,
  "oscillation_degrees": 90,
  "blade_diameter_cm": 15.2,
  "fan_diameter_cm": null,
  "airflow_m3_h": null,
  "airflow_cfm": null,
  "speed_levels": 2,
  "rpm_min": 1400,
  "rpm_max": 2200,
  "noise_db_min": null,
  "noise_db_max": 38,
  "power_watts_min": null,
  "power_watts_max": 20,
  "controller_compatible": false,
  "app_control": false,
  "wifi": false,
  "bluetooth": false,
  "recommended_tent_min_cm": null,
  "recommended_tent_max_cm": null,
  "source_url": "https://vivosun.com/vivosun-aerowave-a6-6-inch-clip-on-fan-p165994380559377559-v165994380559377558",
  "source_type": "manufacturer",
  "source_date": "2026-06-27",
  "confidence_level": "B",
  "uvp_amount": null,
  "uvp_currency": null,
  "notes": "A6 6in AC motor, 2-speed 1400/2200RPM, ~38dB, 20W, 90deg horiz auto+120deg vert manual (vivosun.com/walmart). No WiFi/app. CFM not published. Amazon.de B097D1R11S white 1-pack."
}