{
  "brand": "Secret Jardin",
  "series": "Monkey Fan (W-series)",
  "model": "Oscillating Monkey Fan MFO20 (20W, v2.0)",
  "status": "discontinued",
  "fan_category": "pole_clip_fan",
  "fan_role": "oscillating_fan",
  "include_in_default_airflow_calculator": true,
  "mounting_type": "clip_and_pole",
  "oscillation": true,
  "oscillation_degrees": null,
  "blade_diameter_cm": 17,
  "fan_diameter_cm": 21,
  "airflow_m3_h": null,
  "airflow_cfm": null,
  "speed_levels": 2,
  "rpm_min": 1500,
  "rpm_max": 2300,
  "noise_db_min": null,
  "noise_db_max": null,
  "power_watts_min": null,
  "power_watts_max": 20,
  "controller_compatible": false,
  "app_control": false,
  "wifi": false,
  "bluetooth": false,
  "recommended_tent_min_cm": null,
  "recommended_tent_max_cm": null,
  "source_url": "https://www.secretjardin.com/product/monkey-fan-osc-20w/",
  "source_type": "manufacturer",
  "source_date": "2026-06-27",
  "confidence_level": "B",
  "uvp_amount": 35,
  "uvp_currency": "EUR",
  "notes": "secretjardin: 20W oscillating clip fan, 2-speed 1500/2300rpm, blade ~17cm/grid 21cm, 2m/s@70cm, clip Ø16-21mm. No m3/h published. EU retail 29.90-36.50 EUR. AmazonDE B074VRHWMR verified."
}