{
  "brand": "Secret Jardin",
  "series": "Monkey Fan 24V",
  "model": "Monkey Fan MF2X120 (2 x 120mm duopack)",
  "status": "active",
  "fan_category": "pole_clip_fan",
  "fan_role": "pole_fan",
  "include_in_default_airflow_calculator": false,
  "mounting_type": "clip_and_pole",
  "oscillation": false,
  "oscillation_degrees": null,
  "blade_diameter_cm": 12,
  "fan_diameter_cm": null,
  "airflow_m3_h": 100,
  "airflow_cfm": 58.9,
  "speed_levels": null,
  "rpm_min": null,
  "rpm_max": null,
  "noise_db_min": null,
  "noise_db_max": 30,
  "power_watts_min": null,
  "power_watts_max": 1.5,
  "controller_compatible": null,
  "app_control": false,
  "wifi": false,
  "bluetooth": false,
  "recommended_tent_min_cm": null,
  "recommended_tent_max_cm": 60,
  "source_url": "https://www.secretjardin.com/air-circulation-monkey-fan-24v/",
  "source_type": "manufacturer",
  "source_date": "2026-06-27",
  "confidence_level": "B",
  "uvp_amount": null,
  "uvp_currency": null,
  "notes": "secretjardin: twin-pack of 2x MF120, per-unit specs identical (100 m3/h, 1.5W, <30dB, 120mm, 16-19mm poles). Excluded from calculator to avoid double-counting same model."
}