{
  "brand": "RAM",
  "series": "RAM Oscillating Multi Fan",
  "model": "Oscillating Multi Fan 180mm (7\")",
  "status": "active",
  "fan_category": "clip_fan",
  "fan_role": "oscillating_fan",
  "include_in_default_airflow_calculator": true,
  "mounting_type": "multi",
  "oscillation": true,
  "oscillation_degrees": null,
  "blade_diameter_cm": 18,
  "fan_diameter_cm": null,
  "airflow_m3_h": null,
  "airflow_cfm": null,
  "speed_levels": 2,
  "rpm_min": null,
  "rpm_max": null,
  "noise_db_min": null,
  "noise_db_max": null,
  "power_watts_min": 20,
  "power_watts_max": 20,
  "controller_compatible": false,
  "app_control": false,
  "wifi": false,
  "bluetooth": false,
  "recommended_tent_min_cm": null,
  "recommended_tent_max_cm": null,
  "source_url": "https://www.hydrogarden.com/en-gb/air-movement/ram-180mm-7-oscillating-multi-fan-20w-08--355--278",
  "source_type": "manufacturer",
  "source_date": "2026-06-27",
  "confidence_level": "C",
  "uvp_amount": 24.95,
  "uvp_currency": "GBP",
  "notes": "20W, 180mm impeller, 2 speeds, oscillating; mounts on flat surface, wall, clip, or pole (16-25mm). Airflow/osc degrees not published. Per hydrogarden (RAM), londongrow."
}