{
  "brand": "Cornwall Electronics",
  "series": "Oscillating Clip Fan",
  "model": "Oscillating Clip Fan 20W (20 cm)",
  "status": "active",
  "fan_category": "clip_fan",
  "fan_role": "oscillating_fan",
  "include_in_default_airflow_calculator": true,
  "mounting_type": "clip",
  "oscillation": true,
  "oscillation_degrees": 90,
  "blade_diameter_cm": 20,
  "fan_diameter_cm": 20,
  "airflow_m3_h": null,
  "airflow_cfm": null,
  "speed_levels": 2,
  "rpm_min": null,
  "rpm_max": 2100,
  "noise_db_min": null,
  "noise_db_max": 29,
  "power_watts_min": 20,
  "power_watts_max": 20,
  "controller_compatible": false,
  "app_control": false,
  "wifi": false,
  "bluetooth": false,
  "recommended_tent_min_cm": null,
  "recommended_tent_max_cm": null,
  "source_url": "https://www.electrocornwall.com/ventiladores.php?lang=en_UK",
  "source_type": "manufacturer",
  "source_date": "2026-06-27",
  "confidence_level": "B",
  "uvp_amount": null,
  "uvp_currency": null,
  "notes": "Code VTP3. 20W, 20cm, 2100 rpm, 2-speed, 90deg oscillation, ~29 dBA, clip 16-30mm. Sources: electrocornwall.com (mfr), pevgrow/semillas (noise)."
}