{
  "brand": "Cyclone",
  "series": "Cyclone Pedestal Fan",
  "model": "Cyclone 16\" Pedestal Fan",
  "status": "active",
  "fan_category": "floor_fan",
  "fan_role": "oscillating_fan",
  "include_in_default_airflow_calculator": true,
  "mounting_type": "floor_stand",
  "oscillation": true,
  "oscillation_degrees": 90,
  "blade_diameter_cm": 40,
  "fan_diameter_cm": null,
  "airflow_m3_h": null,
  "airflow_cfm": null,
  "speed_levels": 3,
  "rpm_min": null,
  "rpm_max": null,
  "noise_db_min": null,
  "noise_db_max": null,
  "power_watts_min": 45,
  "power_watts_max": 45,
  "controller_compatible": false,
  "app_control": false,
  "wifi": false,
  "bluetooth": false,
  "recommended_tent_min_cm": null,
  "recommended_tent_max_cm": null,
  "source_url": "https://www.thegrowsuperstore.com/products/cyclone-16-inch-pedestal-stand-cooling-fan",
  "source_type": "retailer",
  "source_date": "2026-06-27",
  "confidence_level": "C",
  "uvp_amount": 24.99,
  "uvp_currency": "GBP",
  "notes": "16in/40cm 5-blade pedestal, ~45W, 3-speed, 90deg osc +30deg tilt, cross base, height-adj, GBP24.99. thegrowsuperstore/caliponics. No airflow/RPM/dB."
}