{
  "brand": "RAM",
  "series": "RAM AirFLEX / Clip Fan",
  "model": "AirFLEX 200mm (8\") Clip Fan",
  "status": "active",
  "fan_category": "clip_fan",
  "fan_role": "oscillating_fan",
  "include_in_default_airflow_calculator": true,
  "mounting_type": "clip_and_pole",
  "oscillation": true,
  "oscillation_degrees": 90,
  "blade_diameter_cm": 20,
  "fan_diameter_cm": null,
  "airflow_m3_h": null,
  "airflow_cfm": null,
  "speed_levels": 2,
  "rpm_min": null,
  "rpm_max": 2600,
  "noise_db_min": null,
  "noise_db_max": 30,
  "power_watts_min": 25,
  "power_watts_max": 25,
  "controller_compatible": false,
  "app_control": false,
  "wifi": false,
  "bluetooth": false,
  "recommended_tent_min_cm": null,
  "recommended_tent_max_cm": null,
  "source_url": "https://www.hydrogarden.com/en-gb/ram-airflex-200mm-8-clip-fan-25w-08--355--170",
  "source_type": "manufacturer",
  "source_date": "2026-06-27",
  "confidence_level": "B",
  "uvp_amount": 30,
  "uvp_currency": "GBP",
  "notes": "25W, 200mm impeller, 2600 rpm, 2 speeds, 90deg oscillating base + 360deg grille, max 30 dB, clip for poles 16-25mm. Per hydrogarden (RAM). Airflow not published. Amazon.co.uk B0FN4MH8SJ (not .de)."
}