{
  "brand": "AC Infinity",
  "series": "CLOUDLIFT",
  "model": "CLOUDLIFT S12",
  "status": "active",
  "fan_category": "floor_fan",
  "fan_role": "floor_fan",
  "include_in_default_airflow_calculator": true,
  "mounting_type": "multi",
  "oscillation": false,
  "oscillation_degrees": null,
  "blade_diameter_cm": 30.5,
  "fan_diameter_cm": 38.8,
  "airflow_m3_h": 3070,
  "airflow_cfm": 1807,
  "speed_levels": 10,
  "rpm_min": null,
  "rpm_max": null,
  "noise_db_min": null,
  "noise_db_max": 62,
  "power_watts_min": null,
  "power_watts_max": 54,
  "controller_compatible": false,
  "app_control": false,
  "wifi": false,
  "bluetooth": false,
  "recommended_tent_min_cm": null,
  "recommended_tent_max_cm": null,
  "source_url": "https://acinfinity.com/hydroponics-growers/circulation/commercial-floor-wall-fans/cloudlift-s12-floor-wall-fan-with-wireless-controller-12-inch/",
  "source_type": "manufacturer",
  "source_date": "2026-06-27",
  "confidence_level": "A",
  "uvp_amount": 165.9,
  "uvp_currency": "EUR",
  "notes": "12in EC floor/wall circulator. 1807 CFM, 54W, 62dBA, 10-speed wireless remote, IP44, 360deg tilt (no auto-oscillation). UVP EUR165.90. Source: acinfinity.com"
}